{"$schema":"https://json-schema.org/draft/2020-12/schema","$id":"https://mindclade.dev/schemas/dataset-manifest/v1","title":"DatasetManifest","type":"object","additionalProperties":false,"required":["schema_version","kind","metadata","spec","lineage","integrity"],"properties":{"schema_version":{"const":"mindclade.dataset-manifest/v1"},"kind":{"const":"DatasetManifest"},"metadata":{"$ref":"#/$defs/metadata"},"spec":{"type":"object","additionalProperties":false,"required":["dataset_name","format","record_count","data","coordinate_frame","measurement_units","use_classification"],"properties":{"dataset_name":{"type":"string","minLength":1,"maxLength":128},"format":{"enum":["PARQUET","ARROW_IPC","JSONL"]},"record_count":{"type":"integer","minimum":0},"data":{"$ref":"#/$defs/artifact_ref"},"coordinate_frame":{"type":"string","minLength":1,"maxLength":64},"measurement_units":{"type":"object","minProperties":1,"maxProperties":32,"propertyNames":{"pattern":"^[a-z][a-z0-9_]{0,63}$"},"additionalProperties":{"type":"string","minLength":1,"maxLength":32}},"use_classification":{"const":"NON_CLINICAL_RESEARCH"}}},"lineage":{"type":"array","minItems":1,"maxItems":64,"items":{"$ref":"#/$defs/artifact_ref"}},"integrity":{"$ref":"#/$defs/integrity"}},"$defs":{"digest":{"type":"string","pattern":"^sha256:[a-f0-9]{64}$"},"metadata":{"type":"object","additionalProperties":false,"required":["uid","created_at","producer","classification"],"properties":{"uid":{"type":"string","minLength":1,"maxLength":128},"created_at":{"type":"string","format":"date-time"},"producer":{"type":"string","minLength":1,"maxLength":128},"classification":{"enum":["PUBLIC","INTERNAL","RESTRICTED"]}}},"artifact_ref":{"type":"object","additionalProperties":false,"required":["uri","digest","media_type","schema_version"],"properties":{"uri":{"type":"string","pattern":"^artifacts/[A-Za-z0-9._~/-]+$"},"digest":{"$ref":"#/$defs/digest"},"media_type":{"type":"string","minLength":1,"maxLength":128},"schema_version":{"type":"string","minLength":1,"maxLength":128}}},"integrity":{"type":"object","additionalProperties":false,"required":["payload_digest"],"properties":{"payload_digest":{"$ref":"#/$defs/digest"},"evidence":{"type":"array","maxItems":32,"items":{"$ref":"#/$defs/artifact_ref"}}}}}}
