{"schema_version":"mindclade.dataset-manifest/v1","kind":"DatasetManifest","metadata":{"uid":"dataset-001","created_at":"2026-08-31T12:00:00Z","producer":"dataset-service","classification":"INTERNAL"},"spec":{"dataset_name":"nonclinical-fixture","format":"PARQUET","record_count":128,"data":{"uri":"artifacts/dataset-001/data","digest":"sha256:aaaaaaaaaaaaaaaaaaaaaaaaaaaaaaaaaaaaaaaaaaaaaaaaaaaaaaaaaaaaaaaa","media_type":"application/vnd.apache.parquet","schema_version":"mindclade.dataset-table/v1"},"coordinate_frame":"sequence-index-0-based","measurement_units":{"position":"index","confidence":"probability"},"use_classification":"NON_CLINICAL_RESEARCH"},"lineage":[{"uri":"artifacts/source-001","digest":"sha256:bbbbbbbbbbbbbbbbbbbbbbbbbbbbbbbbbbbbbbbbbbbbbbbbbbbbbbbbbbbbbbbb","media_type":"application/json","schema_version":"mindclade.source-record/v1"}],"integrity":{"payload_digest":"sha256:cccccccccccccccccccccccccccccccccccccccccccccccccccccccccccccccc","evidence":[]}}
